{"extractor":"cmake-makefiles-v1","nodes":[{"arguments":["/nologo","/TP","-I${SOURCE}/.","/Zi","/O2","/Ob1","-MD","/Fo${BUILD}/CMakeFiles/grind_progress.dir/transform_one.cpp.obj","/Fd${BUILD}/CMakeFiles/grind_progress.dir/transform_one.cpp.obj.pdb","-c","${SOURCE}/transform_one.cpp"],"depends_on":[],"directive_inputs":[],"id":"compiler.grind_progress.0000","inputs":["source/transform_one.cpp"],"outputs":["build/CMakeFiles/grind_progress.dir/transform_one.cpp.obj","build/CMakeFiles/grind_progress.dir/transform_one.cpp.obj.pdb"],"owner":"grind_progress","role":"compiler","timeout_seconds":900},{"arguments":["/nologo","/TP","-I${SOURCE}/.","/Zi","/O2","/Ob1","-MD","/Fo${BUILD}/CMakeFiles/grind_progress.dir/transform_two.cpp.obj","/Fd${BUILD}/CMakeFiles/grind_progress.dir/transform_two.cpp.obj.pdb","-c","${SOURCE}/transform_two.cpp"],"depends_on":[],"directive_inputs":[],"id":"compiler.grind_progress.0001","inputs":["source/transform_two.cpp"],"outputs":["build/CMakeFiles/grind_progress.dir/transform_two.cpp.obj","build/CMakeFiles/grind_progress.dir/transform_two.cpp.obj.pdb"],"owner":"grind_progress","role":"compiler","timeout_seconds":900},{"arguments":["/nologo","${BUILD}/CMakeFiles/grind_progress.dir/transform_one.cpp.obj","${BUILD}/CMakeFiles/grind_progress.dir/transform_two.cpp.obj","/out:${BUILD}/grind-progress.exe","/implib:${BUILD}/grind-progress.lib","/pdb:${BUILD}/grind-progress.pdb","/version:0.0","/subsystem:console","/nodefaultlib","/entry:transform_one","/include:_transform_two","/subsystem:console"],"depends_on":["compiler.grind_progress.0000","compiler.grind_progress.0001"],"directive_inputs":[],"id":"linker.grind_progress.0002","inputs":["build/CMakeFiles/grind_progress.dir/transform_one.cpp.obj","build/CMakeFiles/grind_progress.dir/transform_two.cpp.obj"],"outputs":["build/grind-progress.exe"],"owner":"grind_progress","role":"linker","target_id":"program","timeout_seconds":900}],"path_profile_id":"dos-stable-v1","schema_version":3,"toolchain_lock_digest":{"algorithm":"sha256","value":"8ab5177318c2840c7559cd144cd9302bda177f01675af71618f918f90e23b36d"}}
