{"extractor":"cmake-makefiles-v1","nodes":[{"arguments":["/nologo","/I${SOURCE}","/Zi","/O2","/Ob1","/Fo${BUILD}/obj/transform.obj","/Fd${BUILD}/obj/transform.pdb","/c","${SOURCE}/transform.cpp"],"depends_on":[],"directive_inputs":[],"id":"compiler.repair.0000","inputs":["source/transform.cpp"],"outputs":["build/obj/transform.obj","build/obj/transform.pdb"],"owner":"repair","role":"compiler","timeout_seconds":900},{"arguments":["/nologo","/I${SOURCE}","/Zi","/O2","/Ob1","/Fo${BUILD}/obj/support.obj","/Fd${BUILD}/obj/support.pdb","/c","${SOURCE}/support.cpp"],"depends_on":[],"directive_inputs":[],"id":"compiler.repair.0001","inputs":["source/support.cpp"],"outputs":["build/obj/support.obj","build/obj/support.pdb"],"owner":"repair","role":"compiler","timeout_seconds":900},{"arguments":["/nologo","/nodefaultlib","/entry:transform","/subsystem:console","/include:_support_marker","/incremental:no","${BUILD}/obj/transform.obj","${BUILD}/obj/support.obj","/out:${BUILD}/repair.exe","/pdb:${BUILD}/repair.pdb"],"depends_on":["compiler.repair.0000","compiler.repair.0001"],"directive_inputs":[],"id":"linker.repair.0002","inputs":["build/obj/support.obj","build/obj/transform.obj"],"outputs":["build/repair.exe"],"owner":"repair","role":"linker","target_id":"program","timeout_seconds":900}],"path_profile_id":"dos-stable-v1","schema_version":3,"toolchain_lock_digest":{"algorithm":"sha256","value":"8ab5177318c2840c7559cd144cd9302bda177f01675af71618f918f90e23b36d"}}
