{"extractor":"cmake-makefiles-v1","nodes":[{"arguments":["/nologo","/I${SOURCE}","/Zi","/O2","/Ob1","/Fo${BUILD}/obj/transform.obj","/Fd${BUILD}/obj/transform.pdb","/c","${SOURCE}/transform.cpp"],"depends_on":[],"directive_inputs":[],"id":"compiler.grind.0000","inputs":["source/transform.cpp"],"outputs":["build/obj/transform.obj","build/obj/transform.pdb"],"owner":"grind","role":"compiler","timeout_seconds":900},{"arguments":["/nologo","/nodefaultlib","/entry:transform","/subsystem:console","${BUILD}/obj/transform.obj","/out:${BUILD}/grind.exe"],"depends_on":["compiler.grind.0000"],"directive_inputs":[],"id":"linker.grind.0001","inputs":["build/obj/transform.obj"],"outputs":["build/grind.exe"],"owner":"grind","role":"linker","target_id":"program","timeout_seconds":900}],"path_profile_id":"dos-stable-v1","schema_version":3,"toolchain_lock_digest":{"algorithm":"sha256","value":"8ab5177318c2840c7559cd144cd9302bda177f01675af71618f918f90e23b36d"}}
